ID,cluster,about,date,type,link,year,month,day
1011614,3570,betreffende de verzekering gewaarborgd wonen,2003-07-18,Besluit van de Vlaamse Regering,,2003.0,7.0,18.0
1013061,3575,"[tot omvorming van het intern verzelfstandigd agentschap met rechtspersoonlijkheid ""Agentschap voor Infrastructuur in het Onderwijs"" naar een publiekrechtelijk vormgegeven extern verzelfstandigd agentschap ""Agentschap voor Infrastructuur in het Onderwijs"" (verv. decr. 16 november 2012, art. 2)]",2004-05-07,Decreet,,2004.0,5.0,7.0
1016041,3576,inzake de certificering van technici voor brandbeveiligingssystemen die ozonafbrekende stoffen of gefluoreerde broeikasgassen bevatten,2007-06-29,Besluit van de Vlaamse Regering,,2007.0,6.0,29.0
1014689,3580,tot uitvoering van artikel 3 van het ministerieel besluit van 18 november 2003 tot uitvoering van het besluit van de Vlaamse Regering van 10 oktober 2003 tot toekenning van steun aan kleine en middelgrote ondernemingen voor investeringen in het Vlaamse Gewest,2006-07-05,Ministerieel besluit,,2006.0,7.0,5.0
1028830,3588,"tot aanduiding van de begrenzing van de afgesloten watervoerende lagen en de heffingsgebieden ter uitvoering van [het decreet van 18 juli 2003 betreffende het integraal waterbeleid, gecoördineerd op 15 juni 2018 (verv. BVR 26 april 2019, art. 144, I: 1 januari 2019)]",2017-12-01,Besluit van de Vlaamse Regering,,2017.0,12.0,1.0
1026696,3589,houdende erkenning en subsidiëring van multifunctionele centra voor minderjarige personen met een handicap,2016-02-26,Besluit van de Vlaamse Regering,,2016.0,2.0,26.0
1023146,3593,betreffende dierlijke bijproducten en afgeleide producten,2013-06-21,Besluit van de Vlaamse Regering,,2013.0,6.0,21.0
1002310,1108,"houdende bepaling voor het Vlaamse Gewest van de categorieën van werken en handelingen, andere dan hinderlijke inrichtingen, waarvoor een milieu-effectrapport is vereist voor de volledigheid van de aanvraag om bouwvergunning",1989-03-23,Besluit van de Vlaamse Regering,,1989.0,3.0,23.0
1005507,3602,betreffende de inrichting en de toepassing van de ontwerp-gewestplannen en gewestplannen,1997-07-08,Omzendbrief,,1997.0,7.0,8.0
1000035,3605,[betreffende de doorvoer van afvalstoffen],1984-07-09,Wet,,1984.0,7.0,9.0
1000377,3606,tot vaststelling van de grens der verbintenissen van de waarborg van het Vlaamse Gewest bij toepassing van de wet van 17 juli 1959 tot invoering en ordening van maatregelen tot bevordering van de economische expansie en de oprichting van nieuwe industrieën en de wet van 30 december 1970 op de economische expansie,1981-06-16,Decreet,,1981.0,6.0,16.0
1028889,3611,betreffende het instellen van een tijdelijke terugzetverplichting in de waterlopen Zwalm en IJse en hun zijwaterlopen ter uitvoering van artikel 14 van de wet van 1 juli 1954 op de riviervisserij,2017-12-01,Ministerieel besluit,,2017.0,12.0,1.0
1002306,3615,CUL/1 betreffende de oprichting en erkenning van gemeentelijke raden voor cultuurbeleid,1991-10-30,Omzendbrief,,1991.0,10.0,30.0
1007547,3616,houdende het Geografisch Informatie Systeem Vlaanderen,2000-07-17,Decreet,,2000.0,7.0,17.0
1029669,3623,tot wijziging van diverse besluiten van de Vlaamse Regering en tot bepaling van de berekeningswijze van de waarborgregeling ter uitvoering van het decreet van 21 maart 2014 betreffende maatregelen voor leerlingen met specifieke onderwijsbehoeften,2018-07-20,Besluit van de Vlaamse Regering,,2018.0,7.0,20.0
1002936,3632,tot wijziging van het besluit van de Vlaamse regering van 17 juli 1985 betreffende de instelling en organisatie van het Instituut voor Natuurbehoud,1991-03-13,Besluit van de Vlaamse Regering,,1991.0,3.0,13.0
1013030,3634,"betreffende [...] het publiekrechtelijk vormgegeven extern verzelfstandigde agentschap [De Vlaamse Waterweg nv, naamloze vennootschap van publiek recht]",2004-04-02,Decreet,,2004.0,4.0,2.0
1002431,3639,"betreffende de toewijzing van sommige taken, goederen, rechten en verplichtingen van de Vlaamse Gemeenschap aan het Vlaams Fonds voor Sociale Integratie van Personen met een Handicap",1991-09-11,Besluit van de Vlaamse Regering,,1991.0,9.0,11.0
1003475,3640,nr. B.A.-G- 90/3 betreffende de uitstapmogelijkheid voor bepaalde leden van het gemeentepersoneel,1990-04-04,Omzendbrief,,1990.0,4.0,4.0
1014688,3641,tot aanpassing van de sectorale regelgeving inzake het landbouw- en visserijbeleid aan de herstructurering van de Vlaamse administratie,2006-04-28,Besluit van de Vlaamse Regering,,2006.0,4.0,28.0
1014920,3643,houdende de oprichting van de Mobiliteitsraad van Vlaanderen ,2006-07-07,Decreet,,2006.0,7.0,7.0
1022897,3654,BB 2013/4. Strategische meerjarenplanning (meerjarenplan 2014-2019) en budgettering (budget 2014) volgens de beleids- en beheerscyclus,2013-03-22,Omzendbrief,,2013.0,3.0,22.0
1004578,3657,houdende vaststelling van de personeelsformatie van Kind en Gezin,1996-01-31,Besluit van de Vlaamse Regering,,1996.0,1.0,31.0
1018482,3659,betreffende bepaalde aspecten van de administratieve en geldelijke toestand van bepaalde personeelsleden van het onderwijs die opnieuw in actieve dienst treden of prestaties leveren die als overwerk of bijbetrekking worden beschouwd,2009-09-04,Besluit van de Vlaamse Regering,,2009.0,9.0,4.0
1014867,3662,"tot omvorming van het Vlaams Infrastructuurfonds voor Persoonsgebonden Aangelegenheden tot een intern verzelfstandigd agentschap met rechtspersoonlijkheid, en tot wijziging van het decreet van 23 februari 1994 inzake de infrastructuur voor persoonsgebonden aangelegenheden ",2006-06-02,Decreet,,2006.0,6.0,2.0
1035273,3665,over de beleids- en beheerscyclus van de Vlaamse Gemeenschapscommissie,2020-12-04,Besluit van de Vlaamse Regering,,2020.0,12.0,4.0
1003570,3666,"betreffende de boekhouding voor de erkende thuisbegeleidingsdiensten voor gehandicapten in uitvoering van artikel 14, § 2, van het besluit van de Vlaamse regering van 7 februari 1990 houdende vaststelling van de erkenningsvoorwaarden, de werkings- en subsidiëringsmodaliteiten voor thuisbegeleidingsdiensten, zoals bedoeld in artikel 3, §1bis, van het koninklijk besluit nr. 81 van 10 november 1967 tot instelling van een Fonds voor medische, sociale en pedagogische zorg voor gehandicapten",1990-03-13,Ministerieel besluit,,1990.0,3.0,13.0
1022373,3667,houdende vaststelling van maatregelen ter ondersteuning van kwetsbare jongvolwassen personen met een handicap,2012-09-07,Besluit van de Vlaamse Regering,,2012.0,9.0,7.0
1012126,3672,"houdende vaststelling van nadere regels voor de subsidiëring van bepaalde werken, leveringen en diensten die in het Vlaamse Gewest door of op initiatief van lagere besturen of ermee gelijkgestelde rechtspersonen worden uitgevoerd",2004-01-23,Ministerieel besluit,,2004.0,1.0,23.0
1011701,3673,tot toekenning van steun aan kleine en middelgrote ondernemingen voor investeringen in het Vlaamse Gewest,2003-10-10,Besluit van de Vlaamse Regering,,2003.0,10.0,10.0
1014957,3678,betreffende de organisatie van tijdelijke projecten in het basis- en secundair onderwijs,2006-06-23,Besluit van de Vlaamse Regering,,2006.0,6.0,23.0
1001303,3689,nr. 66 tot vaststelling van de wijze waarop de ambten van het administratief personeel en het opvoedend hulppersoneel worden bepaald in de inrichtingen voor buitengewoon onderwijs met uitzondering van de internaten of semi-internaten,1982-07-20,Genummerd koninklijk besluit,,1982.0,7.0,20.0
1006357,3695,houdende regeling van de tenlasteneming van kosten verbonden aan de door de gemeenten geboden administratieve ondersteuning in geval van algemene ramp,1998-09-22,Besluit van de Vlaamse Regering,,1998.0,9.0,22.0
1014105,3700,tot oprichting van het intern verzelfstandigd agentschap zonder rechtspersoonlijkheid Agentschap voor Maritieme Dienstverlening en Kust,2005-10-07,Besluit van de Vlaamse Regering,,2005.0,10.0,7.0
1006472,3703,houdende instelling van een aanmoedigingspremie voor loopbaanonderbreking voor de personeelsleden van de Vlaamse openbare sector en het Nederlandstalig onderwijs in het raam van de maatregelen tot herverdeling van de arbeid,1998-09-22,Besluit van de Vlaamse Regering,,1998.0,9.0,22.0
1017352,3707,tot vaststelling van de voorwaarden voor het verkrijgen van een subsidie voor de facultatieve opdracht jeugdsport,2008-09-12,Besluit van de Vlaamse Regering,,2008.0,9.0,12.0
1001702,3711,"houdende maatregelen van toepassing in het Vlaamse Gewest ter bescherming van bepaalde in het wild levende inheemse diersoorten die niet onder de toepassing vallen van de wetten en besluiten op de jacht, de riviervisserij en de vogelbescherming",1980-09-22,Koninklijk Besluit,,1980.0,9.0,22.0
1017360,3718,tot delegatie van sommige bevoegdheden aan personeelsleden van het Departement Landbouw en Visserij,2008-12-09,Besluit van de secretaris-generaal,,2008.0,12.0,9.0
1000005,3727,betreffende het georganiseerd vrijwilligerswerk in de welzijns- en gezondheidssector,1994-03-23,Decreet,,1994.0,3.0,23.0
1017517,3728,houdende bepalingen tot begeleiding van de tweede aanpassing van de begroting 2008 ,2008-11-21,Decreet,,2008.0,11.0,21.0
1007927,3729,"houdende de samenstelling en de werking van de Stuurgroep GIS-Vlaanderen, het Wetenschappelijk Comité GIS-Vlaanderen en de Geografische Informatie Raad",2001-02-02,Besluit van de Vlaamse Regering,,2001.0,2.0,2.0
1006046,3732,houdende harmonisering van diverse stelsels werkervaringsprojecten,1997-06-17,Besluit van de Vlaamse Regering,,1997.0,6.0,17.0
1000335,3739,betreffende de controle op de afwezigheid wegens ziekte,1993-12-08,Besluit van de Vlaamse Regering,,1993.0,12.0,8.0
1017945,3742,tot toekenning van een beëindigingspremie voor de definitieve onttrekking van vissersvaartuigen aan de zeevisserijactiviteit in het kader van een vlootaanpassingsregeling ,2009-06-02,Ministerieel besluit,,2009.0,6.0,2.0
1033897,3746,"houdende diverse dringende maatregelen ingevolge COVID-19 voor de centra voor leerlingenbegeleiding, het onderwijspersoneel, de academies deeltijds kunstonderwijs, de centra voor volwassenonderwijs en de centra voor basiseducatie houdende wijziging van het besluit van de Vlaamse Regering van 5 juni 2020 tot toekenning van extra werkingsbudget voor de scholen van het gewoon en buitengewoon basis- en secundair onderwijs omwille van de genomen maatregelen en hieraan verbonden extra onkosten gemaakt door de scholen tegen verspreiding van COVID-19 m.b.t. de internaten",2020-11-13,Besluit van de Vlaamse Regering,,2020.0,11.0,13.0
1027707,3748,sommige bepalingen voor het onderwijs,2016-10-28,Gecodificeerd Decreet,,2016.0,10.0,28.0
1002389,3749,houdende algemeen reglement op de giftige afval,1976-02-09,Koninklijk Besluit,,1976.0,2.0,9.0
1015165,3754,tot vaststelling van de regels voor het algemene personeelsbeleid en het specifieke personeelsbeleid in de diensten van de Vlaamse overheid en in de Vlaamse openbare instellingen ,2006-09-29,Besluit van de Vlaamse Regering,,2006.0,9.0,29.0
1024895,3755,betreffende de toekenning van een facultatieve subsidie in hoofde van de organiserende besturen van de consultatiebureaus voor het jonge kind die arts-bedienden tewerkstellen,2014-12-16,Ministerieel besluit,,2014.0,12.0,16.0
1014458,3761,houdende delegatie van sommige bevoegdheden inzake het energiebeleid aan personeelsleden van het [VEKA],2006-03-31,Ministerieel besluit,,2006.0,3.0,31.0
1013198,3763,tot oprichting van het intern verzelfstandigd agentschap Sociaal-Cultureel Werk [voor Jeugd en Volwassenen],2004-06-11,Besluit van de Vlaamse Regering,,2004.0,6.0,11.0
1016509,3778,van het Agentschap voor Facilitair Management houdende subdelegatie van sommige bevoegdheden inzake algemene werking van het Agentschap voor Facilitair Management ,2007-12-11,Besluit van de administrateur-generaal,,2007.0,12.0,11.0
1003220,3780,"tot vaststelling van de leer- en opvoedende activiteiten in het buitengewoon kleuter-, lager en basisonderwijs en in de opleidingsvormen 1, 2 en 3 van het buitengewoon secundair onderwijs",1990-06-27,Besluit van de Vlaamse Regering,,1990.0,6.0,27.0
1019255,3784,betreffende de modulaire structuur van het secundair volwassenenonderwijs voor het studiegebied lichaamsverzorging,2010-06-11,Besluit van de Vlaamse Regering,,2010.0,6.0,11.0
1008989,3785,"[met betrekking tot de subsidiëring van de aanleg van openbare rioleringen, andere dan prioritaire rioleringen, de bouw van kleinschalige rioolwaterzuiveringsinstallaties met inbegrip van de aanleg van individuele waterzuiveringsinstallaties door de gemeenten, gemeentebedrijven, intercommunales, intergemeentelijke samenwerkingsverbanden of de Vlaamse Maatschappij voor Watervoorziening (verv. BVR 21 januari 2011, art. 1]",2002-02-01,Besluit van de Vlaamse Regering,,2002.0,2.0,1.0
1007569,3816,betreffende de overdracht van de leerlingendossiers van de PMS- en MST-Centra naar de centra voor leerlingenbegeleiding,2000-07-17,Besluit van de Vlaamse Regering,,2000.0,7.0,17.0
1004757,3834,betreffende de personeelsleden van de vierde graad van het voltijds secundair onderwijs,1996-07-09,Besluit van de Vlaamse Regering,,1996.0,7.0,9.0
1001615,3842,houdende vaststelling van de voorwaarden tot en van de procedure van de erkenning van de volledige gelijkwaardigheid van buitenlandse diploma's en studiegetuigschriften met de diploma's van de academische graden met uitzondering van de academische graden van de eerste cyclus,1992-10-14,Besluit van de Vlaamse Regering,,1992.0,10.0,14.0
1003122,3845,betreffende de voldoende geachte bekwaamheidsbewijzen in het kleuter- en lager onderwijs,1975-06-20,Koninklijk Besluit,,1975.0,6.0,20.0
1004024,3850,tot vaststelling van het kiesreglement voor de lokale schoolraden en raden van bestuur van het Gemeenschapsonderwijs,1995-09-06,Besluit van de Vlaamse Regering,,1995.0,9.0,6.0
1015357,3851,"ABB 2006/20 aangaande het besluit van de Vlaamse Regering van 24 november 2006 betreffende de inwerkingtreding van sommige bepalingen van het provinciedecreet van 9 december 2005 en ter uitvoering van artikelen 156, 175 en 264 van het provinciedecreet van 9 december 2005",2006-12-01,Omzendbrief,,2006.0,12.0,1.0
1002212,3852,houdende vaststelling van het wapen en de vlag van de provincies en gemeenten,1994-12-21,Decreet,,1994.0,12.0,21.0
1008184,3855,tot uitvoering van [artikel 37 van de Huisvestingscode] waarbij de regering ertoe gemachtigd wordt de bedrijvigheid van de Nationale Maatschappij voor de Huisvesting en van de Nationale Landmaatschappij uit te breiden,1968-12-27,Koninklijk Besluit,,1968.0,12.0,27.0
1003385,3862,betreffende de budgettaire voorstellen 1975-1976,1976-01-05,Wet,,1976.0,1.0,5.0
1015740,3865,betreffende het onderhoud en het nazicht van [centrale] stooktoestellen voor de verwarming van gebouwen of voor de aanmaak van warm verbruikswater ,2006-12-08,Besluit van de Vlaamse Regering,,2006.0,12.0,8.0
1002467,3869,houdende toekenning van toelagen voor sociale vernieuwing in bepaalde gemeenten van het Vlaamse Gewest,1994-12-14,Besluit van de Vlaamse Regering,,1994.0,12.0,14.0
1023693,3871,[houdende de uitvoering van het decreet van 30 april 2009 betreffende de kwalificatiestructuur inzake de erkenning van onderwijskwalificaties van niveau 1 tot en met niveau 4],2014-01-10,Besluit van de Vlaamse Regering,,2014.0,1.0,10.0
1023104,3874,"betreffende de digitale rapportering van gegevens van de beleids- en beheerscyclus van de gemeenten, de provincies en de openbare centra voor maatschappelijk welzijn",2013-07-09,Ministerieel besluit,,2013.0,7.0,9.0
1007524,3891,houdende vaststelling van de personeelsformatie van het Instituut voor Bosbouw en Wildbeheer,2000-07-17,Besluit van de Vlaamse Regering,,2000.0,7.0,17.0
1014547,3893,tot oprichting van het Vlaams Subsidieagentschap voor Werk en Sociale Economie ,2005-10-21,Besluit van de Vlaamse Regering,,2005.0,10.0,21.0
1002809,3899,tot vaststelling van de regels die de onontbeerlijkheid van de beveiligingswerken in de rusthuizen bepalen,1985-07-10,Besluit van de Vlaamse Regering,,1985.0,7.0,10.0
1012005,3910,houdende maatregelen ter uitvoering van het gebiedsgericht natuurbeleid,2003-11-21,Besluit van de Vlaamse Regering,,2003.0,11.0,21.0
1020146,3915,"betreffende de algemene erkenningsvoorwaarden en kwaliteitszorg van voorzieningen voor opvang, behandeling en begeleiding van personen met een handicap",2011-02-04,Besluit van de Vlaamse Regering,,2011.0,2.0,4.0
1015117,3916,tot bekrachtiging van het besluit van de Vlaamse Regering van 23 juni 2006 betreffende de organisatie van tijdelijke projecten in het basis- en secundair onderwijs,2006-07-14,Decreet,,2006.0,7.0,14.0
1028288,3917,"betreffende de subsidiëring van de werken, vermeld in 
[artikel 2.6.1.3.1, § 1 van het decreet van 18 juli 2003 betreffende het integraal waterbeleid, gecoördineerd op 15 juni 2018)]
",2017-05-05,Besluit van de Vlaamse Regering,,2017.0,5.0,5.0
1001513,3919,"tot uitvoering van artikel 87,§2 van het besluit van de Vlaamse regering van 21 december 1988 houdende de organisatie van de arbeidsbemiddeling en de beroepsopleiding",1992-10-28,Besluit van de Vlaamse Regering,,1992.0,10.0,28.0
1007315,3920,"tot uitvoering van artikel 12 van het decreet van 3 maart 1993 houdend eregeling tot erkenning van de outplacement-, wervings- en selectiebureaus in het Vlaamse Gewest",1994-01-10,Ministerieel besluit,,1994.0,1.0,10.0
1032985,3924,over de financiële gevolgen van de maatregelen ter bestrijding van COVID-19 voor voorzieningen voor personen met een handicap en voor personen met een handicap die ondersteuning hebben van het Vlaams Agentschap voor Personen met een Handicap,2020-04-30,Besluit van de Vlaamse Regering,,2020.0,4.0,30.0
1006420,3926,houdende bepalingen tot begeleiding van de begroting 1999,1998-12-19,Decreet,,1998.0,12.0,19.0
1015632,3934,betreffende de organisatie van tijdelijke projecten voor de Opleiding voor Opleiders van Volwassenen,2007-02-09,Besluit van de Vlaamse Regering,,2007.0,2.0,9.0
1014065,3956,tot toekenning van steun voor projecten ter stimulering van het ondernemerschap,2005-10-07,Besluit van de Vlaamse Regering,,2005.0,10.0,7.0
1038106,3963,tot vaststelling van de minimale voorwaarden van de rechtspositieregeling van het personeel van lokale en provinciale besturen,2023-01-20,Besluit van de Vlaamse Regering,,2023.0,1.0,20.0
1001881,3967,inzake bijzondere jeugdbijstand,1990-04-04,Gecodificeerd Decreet,,1990.0,4.0,4.0
1007031,3968,"houdende de voorwaarden, procedure en duur van de erkenning van levensbeschouwelijke [...] en sociaal-economische verenigingen voor het verzorgen van radio- en/of televisieprogramma's op de Vlaamse Radio- en Televisieomroep",1999-10-15,Besluit van de Vlaamse Regering,,1999.0,10.0,15.0
1006573,3804,houdende de erkenning en de subsidiëring van verenigingen en welzijnsvoorzieningen in de thuiszorg,1998-12-18,Besluit van de Vlaamse Regering,,1998.0,12.0,18.0
1023527,3972,betreffende de lokale diensteneconomie ,2013-11-22,Decreet,,2013.0,11.0,22.0
1004638,3976,houdende toekenning van een verlof voorafgaand aan de pensionering bij Kind en Gezin,1996-04-30,Besluit van de Vlaamse Regering,,1996.0,4.0,30.0
1029898,3978,over de zorg en ondersteuning voor personen met een niet-aangeboren hersenletsel of tetraplegie ten gevolge van een hoge dwarslaesie met de hoogste zorg- en ondersteuningsnood,2018-09-28,Besluit van de Vlaamse Regering,,2018.0,9.0,28.0
1016716,3979,tot bepaling van de financiële bijdrage van de gezinnen voor de opvang van kinderen in kinderdagverblijven en diensten voor onthaalouders ,2008-03-17,Ministerieel besluit,,2008.0,3.0,17.0
1000336,3984,houdende de organisatie van de controle op de afwezigheid wegens ziekte,1993-12-08,Besluit van de Vlaamse Regering,,1993.0,12.0,8.0
1016701,3987,"tot vaststelling van de regels voor de erkenning en financiering door de Vlaamse Dienst voor Arbeidsbemiddeling en Beroepsopleiding van de gespecialiseerde trajectbepaling- en -begeleidingsdienst, de gespecialiseerde arbeidsonderzoeksdiensten en de gespecialiseerde opleidings-, begeleidings- en bemiddelingsdiensten",2008-02-15,Besluit van de Vlaamse Regering,,2008.0,2.0,15.0
1016363,3989,"tot vaststelling van de nadere voorwaarden en regels volgens welke subsidies worden verleend voor permanente vorming en opleiding voor werkenden en bedrijven, luik « Hefboomkrediet - Opleidingen » ",2007-10-05,Besluit van de Vlaamse Regering,,2007.0,10.0,5.0
1009535,3990,houdende maatregelen om tegemoet te komen aan de noodzaak tot leniging van dringende behoeften van personen met een handicap,2002-07-19,Besluit van de Vlaamse Regering,,2002.0,7.0,19.0
1014686,3995,betreffende de oprichting en de werking van het Fonds voor Landbouw en Visserij ,2006-05-19,Decreet,,2006.0,5.0,19.0
1013955,3998,houdende het algemeen reglement op de gemeentelijke comptabiliteit,1990-08-02,Koninklijk Besluit,,1990.0,8.0,2.0
1024268,3999,tot uitvoering van het Subsidiebesluit van 22 november 2013 ,2014-04-23,Ministerieel besluit,,2014.0,4.0,23.0
1006158,4000,"tot uitvoering van artikel 14, 1e lid van het decreet van 19 april 1995 tot regeling van de bemiddeling tegen betaling",1998-03-03,Ministerieel besluit,,1998.0,3.0,3.0
1000517,4014,betreffende het onderwijs-III,1992-04-09,Decreet,,1992.0,4.0,9.0
1014695,4015,tot vastelling van de voorwaarden van toekenning van een persoonlijke-assistentiebudget ,2006-06-21,Ministerieel besluit,,2006.0,6.0,21.0
1007558,4020,"houdende de regeling van de rechtspositie van het personeel van sommige Vlaamse openbare instellingen (citeeropschrift: ""stambesluit VOI"" afgekort ""SB VOI"")",2000-06-30,Besluit van de Vlaamse Regering,,2000.0,6.0,30.0
1024960,4021,"houdende de procedures voor de aanvraag en de toekenning van een erkenning, een attest van toezicht en de subsidies voor buitenschoolse opvang (citeeropschrift: ""Procedurebesluit Buitenschoolse Opvang van 19 december 2014"")",2014-12-19,Besluit van de Vlaamse Regering,,2014.0,12.0,19.0
1001627,4025,[betreffende het publiekrechtelijk vormgegeven extern verzelfstandigd agentschap Vlaamse Vervoermaatschappij - De Lijn],1990-07-31,Decreet,,1990.0,7.0,31.0
1022783,4026,"tot uitvoering van [het besluit van de Vlaamse Regering van 26 februari 2016 tot toekenning van steun aan kleine en middelgrote ondernemingen voor ondernemerschapsbevorderende diensten en kmo-groeitrajecten], wat betreft de aanstelling en de werking van de auditbureaus",2013-02-14,Ministerieel besluit,,2013.0,2.0,14.0
1005552,4031,betreffende de opdracht van het personeel in het basisonderwijs,1997-06-17,Besluit van de Vlaamse Regering,,1997.0,6.0,17.0
1003443,4032,"nr. 471 tot beperking van het aantal verloven wegens opdracht en de terbeschikkingstelling wegens opdracht, verleend aan de personeelsleden van het onderwijs en de psycho-medisch-sociale centra",1986-10-24,Genummerd koninklijk besluit,,1986.0,10.0,24.0
1004061,4036,houdende bijzondere administratieve bepalingen voor de personeelsleden van Kind en Gezin,1995-06-01,Besluit van de Vlaamse Regering,,1995.0,6.0,1.0
1000708,4042,"tot vastlegging van het pakket ""uren-leraar"" in het voltijds secundair onderwijs [...]",1990-07-31,Besluit van de Vlaamse Regering,,1990.0,7.0,31.0
1029068,4047,betreffende het lokaal sociaal beleid,2018-02-09,Decreet,,2018.0,2.0,9.0
1019628,4052,"betreffende de subsidiëring van crisisjeugdhulpverlening en rechtstreeks toegankelijke jeugdhulp verleend door voorzieningen voor personen met een handicap [...opgeh. BVR 24 januari 2014, art. 1, I: 1 januari 2014)]",2010-09-17,Besluit van de Vlaamse Regering,,2010.0,9.0,17.0
1018446,4055,"[betreffende de modulaire structuur van het secundair volwassenenonderwijs voor de studiegebieden Europese hoofdtalen richtgraad 1 en 2, Europese neventalen richtgraad 1 en 2, Europese talen richtgraad 3 en 4, Oosterse talen, Scandinavische talen en Slavische talen]",2009-07-24,Besluit van de Vlaamse Regering,,2009.0,7.0,24.0
1024337,4058,"houdende de procedures voor de aanvraag en de toekenning van de vergunning en de subsidies voor gezinsopvang en groepsopvang van baby's en peuters (citeeropschrift: ""Procedurebesluit van 9 mei 2014"")",2014-05-09,Besluit van de Vlaamse Regering,,2014.0,5.0,9.0
1017117,4059,tot regeling van de presentiegelden van de leden van de Strategische Adviesraad voor Landbouw en Visserij,2008-07-24,Ministerieel besluit,,2008.0,7.0,24.0
1004642,4063,tot vaststelling van de personeelsformatie van de Dienst voor Infrastructuurwerken van het Gesubsidieerd Onderwijs,1996-04-02,Besluit van de Vlaamse Regering,,1996.0,4.0,2.0
1033344,4065,"tot opheffing van het publiekrechtelijk vormgegeven extern verzelfstandigd agentschap Vlaams Agentschap voor Ondernemersvorming Syntra Vlaanderen, tot regeling van de taken en bevoegdheden en tot wijziging van de naam Hermesfonds",2020-06-19,Decreet,,2020.0,6.0,19.0
1017104,4068,LNE/2008/2 over asbest op Vlaamse containerparken,2008-08-27,Omzendbrief,,2008.0,8.0,27.0
1007127,4070,houdende vaststelling van de voorlopige structuurschema's van het modulair onderwijs voor sociale promotie,1999-09-07,Besluit van de Vlaamse Regering,,1999.0,9.0,7.0
1030012,4082,houdende de kinderopvangtoeslag en kleutertoeslag ,2018-12-07,Besluit van de Vlaamse Regering,,2018.0,12.0,7.0
1006189,4086,"houdende vaststelling van het programma voor [...] serviceflatgebouwen, woningcomplexen met dienstverlening, [en rusthuizen]",1998-03-17,Besluit van de Vlaamse Regering,,1998.0,3.0,17.0
1002852,4087,"houdende de voorwaarden betreffende sociale leningen met gewestwaarborg voor het bouwen, kopen of verbouwen van woningen",1995-01-11,Besluit van de Vlaamse Regering,,1995.0,1.0,11.0
1000372,4089,"houdende delegatie van bevoegdheid aan de Gewestcommissaris bedoeld in het decreet van 1 juli 1987 betreffende de werkwijze van, de controle op en de vaststelling van het ambtsgebied van intercommunales",1994-01-13,Ministerieel besluit,,1994.0,1.0,13.0
1027690,4090,houdende bepalingen tot begeleiding van de begroting 2017,2016-12-23,Decreet,,2016.0,12.0,23.0
